citing_venue_count,citing_field_count,citing_institution_count,citing_country_count,citing_year_min,citing_year_max,citing_year_span,citing_works_sampled,top_citing_work_examples,citing_fields_sample,citing_countries_sample,paper_id,title,openalex_id
19.0,78.0,59.0,20.0,1987.0,2023.0,37.0,50,"[{'title': 'A PRINCIPLE OF UNCERTAINTY FOR INFORMATION SEEKING', 'year': 1993, 'cited_by_count': 755}, {'title': 'COGNITIVE PERSPECTIVES OF INFORMATION RETRIEVAL INTERACTION: ELEMENTS OF A COGNITIVE IR THEORY', 'year': 1996, 'cited_by_count': 706}, {'title': 'Relevance feedback revisited', 'year': 1992, 'cited_by_count': 407}, {'title': 'The seventeen theoretical constructs of information searching and information retrieval', 'year': 2010, 'cited_by_count': 98}, {'title': 'Documents, memory institutions and information science', 'year': 2000, 'cited_by_count': 118}]","['Algorithm', 'Applied psychology', 'Arithmetic', 'Art', 'Artificial intelligence', 'Biology', 'Cartography', 'Civil engineering', 'Cognitive psychology', 'Cognitive science', 'Combinatorics', 'Communication', 'Composite material', 'Computer science', 'Computer security', 'Computer vision', 'Data mining', 'Data science', 'Database', 'Discrete mathematics']","['AU', 'BR', 'CA', 'CH', 'CN', 'DE', 'DK', 'FR', 'GB', 'GR', 'HU', 'IN', 'IT', 'MX', 'MY', 'NL', 'PL', 'SA', 'SG', 'US']",sigir_1986_5b31cf31,A New Theoretical Framework for Information Retrieval,https://openalex.org/W4244048212
13.0,59.0,72.0,18.0,1987.0,2022.0,36.0,50,"[{'title': 'A Markov random field model for term dependencies', 'year': 2005, 'cited_by_count': 848}, {'title': 'Latent concept expansion using markov random fields', 'year': 2007, 'cited_by_count': 227}, {'title': 'Modeling term dependencies with quantum language models for IR', 'year': 2013, 'cited_by_count': 125}, {'title': 'Query by document', 'year': 2009, 'cited_by_count': 115}, {'title': 'Parameterized concept weighting in verbose queries', 'year': 2011, 'cited_by_count': 113}]","['Algorithm', 'Anthropology', 'Archaeology', 'Art', 'Artificial intelligence', 'Astrophysics', 'Biology', 'Botany', 'Combinatorics', 'Composite material', 'Computer science', 'Data mining', 'Data science', 'Database', 'Economics', 'Engineering', 'Epistemology', 'Evolutionary biology', 'Geodesy', 'Geography']","['AU', 'CA', 'CH', 'CN', 'DE', 'FR', 'GB', 'HK', 'IN', 'IT', 'KR', 'MA', 'NL', 'NZ', 'SA', 'TN', 'TW', 'US']",sigir_1987_63b9a46d,Automatic Phrase Indexing for Document Retrieval,https://openalex.org/W1976535830
31.0,72.0,118.0,17.0,2005.0,2019.0,15.0,50,"[{'title': 'Recent advances in physical reservoir computing: A review', 'year': 2019, 'cited_by_count': 1992}, {'title': 'Cerebellum and Nonmotor Function', 'year': 2009, 'cited_by_count': 1788}, {'title': 'Brain mechanisms linking language and action', 'year': 2005, 'cited_by_count': 1786}, {'title': 'Training and plasticity of working memory', 'year': 2010, 'cited_by_count': 1564}, {'title': 'A Taxonomy of External and Internal Attention', 'year': 2010, 'cited_by_count': 1492}]","['Accounting', 'Advertising', 'Agronomy', 'Algorithm', 'Anatomy', 'Archaeology', 'Art', 'Artificial intelligence', 'Astrophysics', 'Audiology', 'Biology', 'Botany', 'Business', 'Chemistry', 'Chromatography', 'Clinical psychology', 'Cognitive psychology', 'Cognitive science', 'Combinatorics', 'Communication']","['AU', 'BE', 'CA', 'CH', 'CN', 'DE', 'FI', 'FR', 'GB', 'IT', 'JP', 'KR', 'NL', 'SE', 'SI', 'TW', 'US']",sigir_1988_12a50dc3,A Look Back and a Look Forward,https://openalex.org/W2066785847
29.0,77.0,54.0,20.0,1991.0,2024.0,34.0,50,"[{'title': 'The Probabilistic Relevance Framework: BM25 and Beyond', 'year': 2009, 'cited_by_count': 2778}, {'title': 'Personalized information delivery', 'year': 1992, 'cited_by_count': 504}, {'title': 'Expertise recommender', 'year': 2000, 'cited_by_count': 426}, {'title': 'Survey of research towards robust peer-to-peer networks: Search methods', 'year': 2006, 'cited_by_count': 386}, {'title': 'Tag recommendations based on tensor dimensionality reduction', 'year': 2008, 'cited_by_count': 314}]","['Algorithm', 'Archaeology', 'Architectural engineering', 'Art', 'Artificial intelligence', 'Biochemistry', 'Biology', 'Botany', 'Business', 'Chemistry', 'Chromatography', 'Civil engineering', 'Cognitive psychology', 'Cognitive science', 'Combinatorics', 'Composite material', 'Computer network', 'Computer science', 'Computer security', 'Computer vision']","['AE', 'AT', 'AU', 'BD', 'CN', 'DE', 'EG', 'ES', 'FR', 'GB', 'GR', 'HK', 'IN', 'IR', 'IT', 'KR', 'NO', 'PT', 'TW', 'US']",sigir_1988_31fae25c,Information Retrieval using a Singular Value Decomposition Model of Latent Semantic Structure,https://openalex.org/W4245049592
18.0,71.0,62.0,19.0,1991.0,2024.0,34.0,50,"[{'title': 'Improved Algorithms for Topic Distillation in a Hyperlinked Environment', 'year': 2017, 'cited_by_count': 677}, {'title': 'Improved algorithms for topic distillation in a hyperlinked environment', 'year': 1998, 'cited_by_count': 440}, {'title': 'Relevance feedback revisited', 'year': 1992, 'cited_by_count': 407}, {'title': 'A survey on the use of relevance feedback for information access systems', 'year': 2003, 'cited_by_count': 401}, {'title': 'Probabilistic Models in Information Retrieval', 'year': 1992, 'cited_by_count': 310}]","['Accounting', 'Agronomy', 'Algorithm', 'Anatomy', 'Anthropology', 'Archaeology', 'Art', 'Artificial intelligence', 'Biochemistry', 'Biology', 'Business', 'Chemistry', 'Chromatography', 'Combinatorics', 'Composite material', 'Computer network', 'Computer science', 'Computer security', 'Crystallography', 'Data mining']","['AR', 'AU', 'CA', 'CN', 'CZ', 'DE', 'DK', 'FR', 'GB', 'IE', 'IL', 'IR', 'JP', 'KR', 'NL', 'TN', 'TR', 'US', 'UY']",sigir_1988_7fa8009d,Towards Interactive Query Expansion,https://openalex.org/W4245350944
7.0,50.0,11.0,6.0,1990.0,2020.0,31.0,16,"[{'title': 'Designing a digital library for young children', 'year': 2001, 'cited_by_count': 110}, {'title': ""The evolution of the international children's digital library searching and browsing interface"", 'year': 2006, 'cited_by_count': 74}, {'title': 'The SOMLib Digital Library System', 'year': 1999, 'cited_by_count': 65}, {'title': 'Ecological framework of information interactions and information infrastructures', 'year': 2009, 'cited_by_count': 42}, {'title': 'Work and work roles: a context of tasks', 'year': 2008, 'cited_by_count': 31}]","['Archaeology', 'Art', 'Artificial intelligence', 'Biology', 'Computer graphics (images)', 'Computer hardware', 'Computer science', 'Data mining', 'Data science', 'Database', 'Economics', 'Economy', 'Electrical engineering', 'Engineering', 'Engineering ethics', 'Epistemology', 'Evolutionary biology', 'Finance', 'Geology', 'Geometry']","['AT', 'DK', 'FI', 'GB', 'SE', 'US']",sigir_1989_83e330e8,A Library System for Information Retrieval based on a Cognitive Task Analysis and Supported by an Icon-based Interface,https://openalex.org/W4251726009
15.0,71.0,59.0,17.0,1989.0,2024.0,36.0,48,"[{'title': 'A comparison of classifiers and document representations for the routing problem', 'year': 1995, 'cited_by_count': 451}, {'title': 'Multi-model semantic interaction for text analytics', 'year': 2014, 'cited_by_count': 71}, {'title': 'An information filtering model on the Web and its application in JobAgent', 'year': 2000, 'cited_by_count': 119}, {'title': 'Text retrieval in the legal world', 'year': 1995, 'cited_by_count': 103}, {'title': 'Regularizing ad hoc retrieval scores', 'year': 2005, 'cited_by_count': 99}]","['Acoustics', 'Algorithm', 'Anthropology', 'Archaeology', 'Art', 'Artificial intelligence', 'Biochemistry', 'Biology', 'Botany', 'Business', 'Cartography', 'Chemical engineering', 'Chemistry', 'Combinatorics', 'Computer architecture', 'Computer network', 'Computer science', 'Computer security', 'Crystallography', 'Data mining']","['AT', 'AU', 'CA', 'DE', 'ES', 'FR', 'GB', 'GR', 'HK', 'HU', 'IE', 'IT', 'KR', 'MX', 'PH', 'TW', 'US']",sigir_1989_e1368db3,Adaptive Information Retrieval: Using a Connectionist Representation to Retrieve and Learn about Documents,https://openalex.org/W4238775936
20.0,60.0,43.0,11.0,1991.0,2020.0,30.0,50,"[{'title': 'Modern Information Retrieval : A Brief Overview', 'year': 2001, 'cited_by_count': 1532}, {'title': 'IR evaluation methods for retrieving highly relevant documents', 'year': 2017, 'cited_by_count': 1463}, {'title': 'A probabilistic model of information retrieval: development and comparative experiments', 'year': 2000, 'cited_by_count': 951}, {'title': 'Pivoted Document Length Normalization', 'year': 2017, 'cited_by_count': 863}, {'title': 'Evaluation of an inference network-based retrieval model', 'year': 1991, 'cited_by_count': 577}]","['Algorithm', 'Anthropology', 'Art', 'Artificial intelligence', 'Biochemistry', 'Biology', 'Chemistry', 'Cognitive psychology', 'Combinatorics', 'Composite material', 'Computer network', 'Computer science', 'Computer security', 'Computer vision', 'Crystallography', 'Data mining', 'Data science', 'Database', 'Economics', 'Epistemology']","['BE', 'CA', 'CH', 'CN', 'DE', 'FI', 'FR', 'GB', 'IL', 'JP', 'US']",sigir_1990_7aa5a101,Inference Networks for Document Retrieval,https://openalex.org/W2019976352
23.0,67.0,48.0,10.0,1993.0,2017.0,25.0,50,"[{'title': 'From Frequency to Meaning: Vector Space Models of Semantics', 'year': 2010, 'cited_by_count': 2865}, {'title': 'Document clustering based on non-negative matrix factorization', 'year': 2003, 'cited_by_count': 1861}, {'title': 'Co-clustering documents and words using bipartite spectral graph partitioning', 'year': 2001, 'cited_by_count': 1710}, {'title': 'Concept Decompositions for Large Sparse Text Data Using Clustering', 'year': 2001, 'cited_by_count': 1295}, {'title': 'Web document clustering', 'year': 1998, 'cited_by_count': 1054}]","['Acoustics', 'Aeronautics', 'Algorithm', 'Archaeology', 'Artificial intelligence', 'Bioinformatics', 'Biology', 'Business', 'Cartography', 'Chemistry', 'Chromatography', 'Cognitive science', 'Combinatorics', 'Composite material', 'Computer graphics (images)', 'Computer network', 'Computer science', 'Computer security', 'Computer vision', 'Crystallography']","['CA', 'CN', 'DE', 'FR', 'IL', 'IN', 'IT', 'PL', 'SG', 'US']",sigir_1992_e446a5cb,Scatter/Gather: A Cluster-based approach to Browsing Large Document Collections,https://openalex.org/W4241122026
25.0,70.0,54.0,16.0,1995.0,2019.0,25.0,50,"[{'title': 'Machine learning in automated text categorization', 'year': 2002, 'cited_by_count': 7879}, {'title': 'Active Learning Literature Survey', 'year': 2009, 'cited_by_count': 4782}, {'title': 'A comparison of event models for naive bayes text classification', 'year': 1998, 'cited_by_count': 3225}, {'title': 'Text Classification from Labeled and Unlabeled Documents using EM', 'year': 2000, 'cited_by_count': 2745}, {'title': 'Naive (Bayes) at forty: The independence assumption in information retrieval', 'year': 1998, 'cited_by_count': 2103}]","['Aerospace engineering', 'Algorithm', 'Archaeology', 'Artificial intelligence', 'Astronomy', 'Biochemistry', 'Bioinformatics', 'Biology', 'Business', 'Chemistry', 'Combinatorics', 'Composite material', 'Computational biology', 'Computer science', 'Computer security', 'Computer vision', 'Crystallography', 'Data mining', 'Data science', 'Database']","['AU', 'BE', 'CA', 'CH', 'CN', 'FR', 'GB', 'IT', 'JP', 'KR', 'NL', 'NZ', 'QA', 'RU', 'SG', 'US']",sigir_1994_13ffa355,A Sequential Algorithm for Training Text Classifiers,https://openalex.org/W2085989833
20.0,68.0,60.0,10.0,1998.0,2021.0,24.0,50,"[{'title': 'Deep learning applications and challenges in big data analytics', 'year': 2015, 'cited_by_count': 2560}, {'title': 'A Language Modeling Approach to Information Retrieval', 'year': 2017, 'cited_by_count': 2544}, {'title': 'Naive (Bayes) at forty: The independence assumption in information retrieval', 'year': 1998, 'cited_by_count': 2103}, {'title': 'A language modeling approach to information retrieval', 'year': 1998, 'cited_by_count': 1722}, {'title': 'Modern Information Retrieval : A Brief Overview', 'year': 2001, 'cited_by_count': 1532}]","['Accounting', 'Agronomy', 'Algorithm', 'Anatomy', 'Anthropology', 'Archaeology', 'Art', 'Artificial intelligence', 'Biochemistry', 'Biology', 'Botany', 'Business', 'Chemistry', 'Combinatorics', 'Composite material', 'Computer network', 'Computer science', 'Computer security', 'Computer vision', 'Data mining']","['AU', 'CA', 'CN', 'FR', 'GB', 'HK', 'IN', 'IT', 'TW', 'US']",sigir_1994_8b4f616e,Some Simple Effective Approximation to the 2-Poisson Model for Probabilistic Weighted Retrieval,https://openalex.org/W2014415866
15.0,71.0,51.0,20.0,1998.0,2024.0,27.0,50,"[{'title': 'Distributed Information Retrieval', 'year': 2005, 'cited_by_count': 387}, {'title': 'Query-based sampling of text databases', 'year': 2001, 'cited_by_count': 370}, {'title': 'Web Crawling', 'year': 2010, 'cited_by_count': 364}, {'title': 'A performance evaluation of gradient field HOG descriptor for sketch based image retrieval', 'year': 2013, 'cited_by_count': 359}, {'title': 'PlanetP: using gossiping to build content addressable peer-to-peer information sharing communities', 'year': 2004, 'cited_by_count': 304}]","['Accounting', 'Advertising', 'Algorithm', 'Anatomy', 'Anthropology', 'Archaeology', 'Art', 'Artificial intelligence', 'Biochemistry', 'Biology', 'Business', 'Chemistry', 'Chromatography', 'Combinatorics', 'Composite material', 'Computer network', 'Computer science', 'Computer security', 'Computer vision', 'Crystallography']","['AU', 'BE', 'CA', 'CH', 'CN', 'DE', 'ES', 'FR', 'GB', 'GR', 'IE', 'IL', 'IR', 'IT', 'JP', 'KR', 'MK', 'NL', 'TR', 'US']",sigir_1995_8c2ca5c7,Searching Distributed Collections with Inference Networks,https://openalex.org/W4255459561
15.0,71.0,65.0,22.0,1996.0,2020.0,25.0,50,"[{'title': 'Naive (Bayes) at forty: The independence assumption in information retrieval', 'year': 1998, 'cited_by_count': 2103}, {'title': 'A Study of Smoothing Methods for Language Models Applied to Ad Hoc Information Retrieval', 'year': 2017, 'cited_by_count': 1571}, {'title': 'Concept Decompositions for Large Sparse Text Data Using Clustering', 'year': 2001, 'cited_by_count': 1295}, {'title': 'Inverted files for text search engines', 'year': 2006, 'cited_by_count': 1075}, {'title': 'A study of smoothing methods for language models applied to Ad Hoc information retrieval', 'year': 2001, 'cited_by_count': 883}]","['Advertising', 'Agronomy', 'Algorithm', 'Anthropology', 'Archaeology', 'Art', 'Artificial intelligence', 'Astronomy', 'Biochemistry', 'Biology', 'Botany', 'Business', 'Cartography', 'Chemistry', 'Combinatorics', 'Composite material', 'Computer network', 'Computer science', 'Computer security', 'Computer vision']","['AE', 'AU', 'BE', 'CA', 'CH', 'CN', 'DE', 'DK', 'ES', 'FI', 'FR', 'GB', 'GR', 'IN', 'IR', 'IT', 'NL', 'NZ', 'PT', 'SG']",sigir_1996_536fcb7e,Pivoted Document Length Normalization,https://openalex.org/W4234200495
15.0,53.0,54.0,13.0,1997.0,2020.0,24.0,50,"[{'title': 'Latent semantic analysis', 'year': 2004, 'cited_by_count': 1108}, {'title': 'A Survey of Automatic Query Expansion in Information Retrieval', 'year': 2012, 'cited_by_count': 1084}, {'title': 'Untangling text data mining', 'year': 1999, 'cited_by_count': 858}, {'title': 'A web-based kernel function for measuring the similarity of short text snippets', 'year': 2006, 'cited_by_count': 743}, {'title': 'Statistical Models for Text Segmentation', 'year': 1999, 'cited_by_count': 684}]","['Artificial intelligence', 'Biochemistry', 'Bioinformatics', 'Biology', 'Botany', 'Chemistry', 'Combinatorics', 'Computer network', 'Computer science', 'Computer security', 'Computer vision', 'Crystallography', 'Data mining', 'Data science', 'Economics', 'Economy', 'Electrical engineering', 'Engineering', 'Epistemology', 'Evolutionary biology']","['AU', 'CA', 'CN', 'DE', 'GB', 'IE', 'IT', 'JO', 'KR', 'NL', 'SG', 'TW', 'US']",sigir_1996_cc49b9c5,Query Expansion using Local and Global Document Analysis,https://openalex.org/W4231856373
11.0,56.0,51.0,13.0,1999.0,2019.0,21.0,50,"[{'title': 'A Study of Smoothing Methods for Language Models Applied to Ad Hoc Information Retrieval', 'year': 2017, 'cited_by_count': 1571}, {'title': 'Learning to Rank for Information Retrieval', 'year': 2009, 'cited_by_count': 1498}, {'title': 'Relevance-Based Language Models', 'year': 2017, 'cited_by_count': 1449}, {'title': 'Automatic image annotation and retrieval using cross-media relevance models', 'year': 2003, 'cited_by_count': 1146}, {'title': 'LDA-based document models for ad-hoc retrieval', 'year': 2006, 'cited_by_count': 1084}]","['Agronomy', 'Artificial intelligence', 'Biochemistry', 'Biology', 'Botany', 'Chemistry', 'Combinatorics', 'Composite material', 'Computer network', 'Computer science', 'Computer security', 'Computer vision', 'Crystallography', 'Data mining', 'Data science', 'Database', 'Economics', 'Economy', 'Engineering', 'Epistemology']","['AU', 'BE', 'CA', 'CN', 'DK', 'FI', 'GB', 'HK', 'IE', 'IL', 'KR', 'NL', 'US']",sigir_1998_fb78786c,A Language Modeling Approach to Information Retrieval,https://openalex.org/W4206765718
18.0,70.0,61.0,16.0,1999.0,2020.0,22.0,50,"[{'title': 'Authoritative sources in a hyperlinked environment', 'year': 1999, 'cited_by_count': 9028}, {'title': 'A faster algorithm for betweenness centrality*', 'year': 2001, 'cited_by_count': 4884}, {'title': 'Graph structure in the Web', 'year': 2000, 'cited_by_count': 2794}, {'title': 'Rank aggregation methods for the Web', 'year': 2001, 'cited_by_count': 1811}, {'title': 'Topic-sensitive PageRank', 'year': 2002, 'cited_by_count': 1532}]","['Agronomy', 'Algorithm', 'Anatomy', 'Architectural engineering', 'Art', 'Artificial intelligence', 'Biology', 'Botany', 'Business', 'Chemistry', 'Cognitive science', 'Combinatorics', 'Composite material', 'Computer network', 'Computer science', 'Computer security', 'Crystallography', 'Data mining', 'Data science', 'Database']","['AU', 'BE', 'BR', 'CA', 'CN', 'DE', 'DK', 'FI', 'GB', 'IL', 'IN', 'IT', 'JP', 'NL', 'SG', 'US']",sigir_1998_9913135f,Improved Algorithms for Topic Distillation in a Hyperlinked Environment,https://openalex.org/W4240407914
24.0,72.0,59.0,20.0,1999.0,2021.0,23.0,50,"[{'title': 'CiteSpace II: Detecting and visualizing emerging trends and transient patterns in scientific literature', 'year': 2005, 'cited_by_count': 5939}, {'title': 'Relevance-Based Language Models', 'year': 2017, 'cited_by_count': 1449}, {'title': 'Web mining research', 'year': 2000, 'cited_by_count': 1438}, {'title': 'Bursty and Hierarchical Structure in Streams', 'year': 2003, 'cited_by_count': 1134}, {'title': 'Bursty and hierarchical structure in streams', 'year': 2002, 'cited_by_count': 1132}]","['Acoustics', 'Agronomy', 'Algorithm', 'Anthropology', 'Archaeology', 'Arithmetic', 'Art', 'Artificial intelligence', 'Astronomy', 'Biology', 'Botany', 'Chemistry', 'Cognitive science', 'Combinatorics', 'Composite material', 'Computer network', 'Computer science', 'Computer security', 'Computer vision', 'Crystallography']","['AE', 'AU', 'BE', 'CA', 'CN', 'DE', 'ES', 'FI', 'FR', 'GB', 'GR', 'HK', 'IN', 'IT', 'JM', 'NL', 'SA', 'SG', 'TW', 'US']",sigir_1998_5e73eaa6,On-line New Event Detection and Tracking,https://openalex.org/W4234917632
17.0,78.0,55.0,18.0,1999.0,2020.0,22.0,50,"[{'title': 'A Diversity-Promoting Objective Function for Neural Conversation Models', 'year': 2016, 'cited_by_count': 2010}, {'title': 'Text Summarization with Pretrained Encoders', 'year': 2019, 'cited_by_count': 1594}, {'title': 'Centroid-based summarization of multiple documents', 'year': 2003, 'cited_by_count': 1047}, {'title': 'Diversifying search results', 'year': 2009, 'cited_by_count': 1021}, {'title': 'SummaRuNNer: A Recurrent Neural Network Based Sequence Model for Extractive Summarization of Documents', 'year': 2017, 'cited_by_count': 952}]","['Advertising', 'Algorithm', 'Anthropology', 'Architectural engineering', 'Artificial intelligence', 'Biochemistry', 'Biology', 'Business', 'Chemistry', 'Combinatorics', 'Communication', 'Composite material', 'Computer graphics (images)', 'Computer science', 'Computer security', 'Computer vision', 'Data mining', 'Data science', 'Database', 'Discrete mathematics']","['BE', 'CA', 'CH', 'CN', 'DE', 'EG', 'ES', 'GB', 'HK', 'IE', 'IL', 'IN', 'IT', 'JO', 'JP', 'KR', 'PT', 'US']",sigir_1998_6199a153,"The use of MMR, Diversity-based Reranking for Reordering Documents and Producing Summaries",https://openalex.org/W3138773240
16.0,70.0,51.0,13.0,2000.0,2022.0,23.0,50,"[{'title': 'Toward the next generation of recommender systems: a survey of the state-of-the-art and possible extensions', 'year': 2005, 'cited_by_count': 10192}, {'title': 'Item-based collaborative filtering recommendation algorithms', 'year': 2001, 'cited_by_count': 8976}, {'title': 'Factorization meets the neighborhood', 'year': 2008, 'cited_by_count': 3919}, {'title': 'Collaborative Filtering for Implicit Feedback Datasets', 'year': 2008, 'cited_by_count': 3206}, {'title': 'Recommender systems survey', 'year': 2013, 'cited_by_count': 3083}]","['Aerospace engineering', 'Algorithm', 'Artificial intelligence', 'Biology', 'Botany', 'Business', 'Cartography', 'Chemistry', 'Combinatorics', 'Composite material', 'Computer network', 'Computer science', 'Computer security', 'Computer vision', 'Crystallography', 'Data mining', 'Data science', 'Database', 'Distributed computing', 'Ecology']","['CA', 'CH', 'CN', 'ES', 'GB', 'GR', 'HK', 'IT', 'JP', 'KR', 'NL', 'SG', 'US']",sigir_1999_521297dd,An Algorithmic Framework for Performing Collaborative Filtering,https://openalex.org/W4232980324
11.0,62.0,58.0,15.0,2000.0,2023.0,24.0,50,"[{'title': 'A Study of Smoothing Methods for Language Models Applied to Ad Hoc Information Retrieval', 'year': 2017, 'cited_by_count': 1571}, {'title': 'Relevance-Based Language Models', 'year': 2017, 'cited_by_count': 1449}, {'title': 'Automatic image annotation and retrieval using cross-media relevance models', 'year': 2003, 'cited_by_count': 1146}, {'title': 'LDA-based document models for ad-hoc retrieval', 'year': 2006, 'cited_by_count': 1084}, {'title': 'Relevance based language models', 'year': 2001, 'cited_by_count': 1024}]","['Acoustics', 'Advertising', 'Agronomy', 'Artificial intelligence', 'Biochemistry', 'Biology', 'Business', 'Chemistry', 'Combinatorics', 'Composite material', 'Computer network', 'Computer science', 'Computer security', 'Computer vision', 'Data mining', 'Data science', 'Database', 'Ecology', 'Economics', 'Economy']","['AU', 'BE', 'CA', 'CN', 'ES', 'FR', 'GB', 'HK', 'IE', 'IL', 'NL', 'PT', 'SG', 'TR', 'US']",sigir_1999_e4b30902,Information Retrieval as Statistical Translation,https://openalex.org/W4245107743
24.0,72.0,65.0,12.0,2000.0,2020.0,21.0,50,"[{'title': 'Sentiment Analysis and Opinion Mining', 'year': 2012, 'cited_by_count': 3256}, {'title': 'Text as Data: The Promise and Pitfalls of Automatic Content Analysis Methods for Political Texts', 'year': 2013, 'cited_by_count': 3095}, {'title': '10.1162/jmlr.2003.3.4-5.993', 'year': 2000, 'cited_by_count': 2967}, {'title': 'From Frequency to Meaning: Vector Space Models of Semantics', 'year': 2010, 'cited_by_count': 2865}, {'title': 'The Probabilistic Relevance Framework: BM25 and Beyond', 'year': 2009, 'cited_by_count': 2778}]","['Aerospace engineering', 'Algorithm', 'Archaeology', 'Architectural engineering', 'Art', 'Artificial intelligence', 'Biology', 'Botany', 'Business', 'Cartography', 'Chemistry', 'Combinatorics', 'Composite material', 'Computer science', 'Computer security', 'Computer vision', 'Data mining', 'Data science', 'Database', 'Distributed computing']","['CA', 'CN', 'CO', 'DE', 'EG', 'ES', 'FR', 'GB', 'IL', 'IN', 'SG', 'US']",sigir_1999_c5218e0a,Probabilistic Latent Semantic Indexing,https://openalex.org/W4233135949
19.0,70.0,63.0,19.0,2001.0,2024.0,24.0,50,"[{'title': 'Retrieval evaluation with incomplete information', 'year': 2004, 'cited_by_count': 738}, {'title': 'User performance versus precision measures for simple search tasks', 'year': 2006, 'cited_by_count': 393}, {'title': 'Graph Matching Algorithms for Business Process Model Similarity Search', 'year': 2009, 'cited_by_count': 391}, {'title': 'The Philosophy of Information Retrieval Evaluation', 'year': 2002, 'cited_by_count': 384}, {'title': 'Information retrieval system evaluation', 'year': 2005, 'cited_by_count': 367}]","['Aerospace engineering', 'Algorithm', 'Arithmetic', 'Art', 'Artificial intelligence', 'Biochemistry', 'Biology', 'Business', 'Chemistry', 'Chromatography', 'Cognitive psychology', 'Combinatorics', 'Communication', 'Composite material', 'Computer network', 'Computer science', 'Computer security', 'Computer vision', 'Data mining', 'Data science']","['AT', 'AU', 'BR', 'CA', 'DE', 'EE', 'ES', 'FI', 'FR', 'GB', 'IE', 'IT', 'JP', 'MX', 'NL', 'RO', 'SA', 'TR', 'US']",sigir_2000_aed95749,Evaluating Evaluation Measure Stability,https://openalex.org/W4233760227
