citing_venue_count,citing_field_count,citing_institution_count,citing_country_count,citing_year_min,citing_year_max,citing_year_span,citing_works_sampled,top_citing_work_examples,citing_fields_sample,citing_countries_sample,paper_id,title,openalex_id
18.0,67.0,30.0,6.0,1987.0,2018.0,32.0,50,"[{'title': 'A case for redundant arrays of inexpensive disks (RAID)', 'year': 1988, 'cited_by_count': 2296}, {'title': 'Parallel database systems', 'year': 1992, 'cited_by_count': 1288}, {'title': 'Query evaluation techniques for large databases', 'year': 1993, 'cited_by_count': 1257}, {'title': 'RAID: high-performance, reliable secondary storage', 'year': 1994, 'cited_by_count': 1192}, {'title': 'Transactional information systems: theory, algorithms, and the practice of concurrency control and recovery', 'year': 2002, 'cited_by_count': 619}]","['Agronomy', 'Algorithm', 'Art', 'Artificial intelligence', 'Biochemistry', 'Biology', 'Business', 'Chemistry', 'Combinatorics', 'Communication', 'Composite material', 'Computational science', 'Computer architecture', 'Computer engineering', 'Computer hardware', 'Computer network', 'Computer science', 'Computer security', 'Crystallography', 'Data mining']","['AT', 'DE', 'FR', 'SG', 'TW', 'US']",vldb_1988_2e996094,Disk Shadowing,https://openalex.org/W2912230285
19.0,67.0,55.0,15.0,1990.0,2018.0,29.0,50,"[{'title': 'CURE', 'year': 1998, 'cited_by_count': 1915}, {'title': 'Fast subsequence matching in time-series databases', 'year': 1994, 'cited_by_count': 1719}, {'title': 'Image Retrieval: Current Techniques, Promising Directions, and Open Issues', 'year': 1999, 'cited_by_count': 1593}, {'title': 'Multidimensional access methods', 'year': 1998, 'cited_by_count': 1591}, {'title': 'M-tree: An Efficient Access Method for Similarity Search in Metric Spaces', 'year': 1997, 'cited_by_count': 1538}]","['Acoustics', 'Aerospace engineering', 'Agronomy', 'Algorithm', 'Applied mathematics', 'Archaeology', 'Art', 'Artificial intelligence', 'Biochemistry', 'Biology', 'Cartography', 'Chemistry', 'Combinatorics', 'Composite material', 'Computer science', 'Computer security', 'Computer vision', 'Crystallography', 'Data mining', 'Data science']","['BR', 'CA', 'CH', 'DE', 'DK', 'GB', 'GR', 'HK', 'IL', 'IT', 'KR', 'MY', 'PK', 'SG', 'US']",vldb_1987_cd8865d1,The R+-Tree: A Dynamic Index for Multi-Dimensional Objects,https://openalex.org/W2131620262
21.0,62.0,55.0,13.0,1987.0,2020.0,34.0,50,"[{'title': 'Query evaluation techniques for large databases', 'year': 1993, 'cited_by_count': 1257}, {'title': 'Semantic database modeling: survey, applications, and research issues', 'year': 1987, 'cited_by_count': 1143}, {'title': 'Shoring up persistent applications', 'year': 1994, 'cited_by_count': 421}, {'title': 'Volcano-an extensible and parallel query evaluation system', 'year': 1994, 'cited_by_count': 392}, {'title': 'Encapsulation of parallelism in the Volcano query processing system', 'year': 1990, 'cited_by_count': 344}]","['Aerospace engineering', 'Algorithm', 'Archaeology', 'Arithmetic', 'Art', 'Artificial intelligence', 'Biochemistry', 'Biology', 'Chemistry', 'Civil engineering', 'Cognitive science', 'Combinatorics', 'Composite material', 'Computer network', 'Computer science', 'Computer security', 'Computer vision', 'Data mining', 'Data science', 'Database']","['AU', 'BR', 'CA', 'CH', 'DE', 'ES', 'FR', 'GB', 'HK', 'IT', 'JP', 'KR', 'US']",vldb_1986_2e7892c2,Object and File Management in the EXODUS Extensible Database System,https://openalex.org/W1508355855
21.0,64.0,48.0,13.0,1986.0,2011.0,26.0,50,"[{'title': 'Groupware: some issues and experiences', 'year': 1991, 'cited_by_count': 2758}, {'title': 'Concurrency control in groupware systems', 'year': 1989, 'cited_by_count': 867}, {'title': 'Concurrency control in groupware systems', 'year': 1989, 'cited_by_count': 450}, {'title': 'Principles and realization strategies of multilevel transaction management', 'year': 1991, 'cited_by_count': 242}, {'title': 'Object-oriented databases: definition and research directions', 'year': 1990, 'cited_by_count': 325}]","['Algorithm', 'Art', 'Artificial intelligence', 'Biology', 'Botany', 'Business', 'Combinatorics', 'Computer graphics (images)', 'Computer network', 'Computer science', 'Computer security', 'Data mining', 'Data science', 'Database', 'Discrete mathematics', 'Distributed computing', 'Ecology', 'Economics', 'Electrical engineering', 'Engineering']","['AU', 'CH', 'CN', 'DE', 'FI', 'FR', 'IL', 'IN', 'IT', 'KR', 'NL', 'NO', 'US']",vldb_1985_2e940bdd,A Model of CAD Transactions,https://openalex.org/W196018858
10.0,69.0,52.0,15.0,2007.0,2024.0,18.0,50,"[{'title': 'Android permissions demystified', 'year': 2011, 'cited_by_count': 1282}, {'title': 'Feedback-Directed Random Test Generation', 'year': 2007, 'cited_by_count': 846}, {'title': 'Software Testing Research: Achievements, Challenges, Dreams', 'year': 2007, 'cited_by_count': 829}, {'title': 'Pex–White Box Test Generation for .NET', 'year': 2008, 'cited_by_count': 784}, {'title': ""A Hitchhiker's guide to statistical tests for assessing randomized algorithms in software engineering"", 'year': 2012, 'cited_by_count': 599}]","['Agronomy', 'Algorithm', 'Anthropology', 'Archaeology', 'Art', 'Artificial intelligence', 'Biochemistry', 'Biology', 'Business', 'Cardiology', 'Chemistry', 'Clinical psychology', 'Communication', 'Computer science', 'Computer security', 'Criminology', 'Data mining', 'Data science', 'Demography', 'Discrete mathematics']","['AU', 'BR', 'CA', 'CH', 'CN', 'DE', 'DK', 'GB', 'GR', 'HK', 'IT', 'KR', 'LU', 'NO', 'US']",icse_2007_280356c8,Feedback-Directed Random Test Generation,https://openalex.org/W2107709519
9.0,63.0,60.0,14.0,2005.0,2017.0,13.0,50,"[{'title': 'GenProg: A Generic Method for Automatic Software Repair', 'year': 2011, 'cited_by_count': 1056}, {'title': 'Automatically finding patches using genetic programming', 'year': 2009, 'cited_by_count': 770}, {'title': 'Classifying Software Changes: Clean or Buggy?', 'year': 2008, 'cited_by_count': 666}, {'title': 'Global Software Engineering: The Future of Socio-technical Coordination', 'year': 2007, 'cited_by_count': 646}, {'title': 'An exploratory study of the pull-based software development model', 'year': 2014, 'cited_by_count': 608}]","['Aerospace engineering', 'Anthropology', 'Archaeology', 'Art', 'Artificial intelligence', 'Astronomy', 'Biochemistry', 'Biology', 'Botany', 'Chemistry', 'Chromatography', 'Cognitive psychology', 'Combinatorics', 'Communication', 'Computer science', 'Computer security', 'Computer vision', 'Data mining', 'Data science', 'Database']","['AT', 'BE', 'CA', 'CH', 'CN', 'DE', 'GB', 'HK', 'IT', 'JP', 'KR', 'NL', 'SG', 'US']",icse_2006_f23af9a0,Who Should Fix This Bug,https://openalex.org/W2079317829
12.0,62.0,62.0,16.0,2005.0,2020.0,16.0,50,"[{'title': 'An Analysis and Survey of the Development of Mutation Testing', 'year': 2010, 'cited_by_count': 1690}, {'title': 'Supporting Controlled Experimentation with Testing Techniques: An Infrastructure and its Potential Impact', 'year': 2005, 'cited_by_count': 1153}, {'title': 'A Survey on Software Fault Localization', 'year': 2016, 'cited_by_count': 1063}, {'title': 'A taxonomy of model‐based testing approaches', 'year': 2011, 'cited_by_count': 617}, {'title': 'Requirements Coverage as an Adequacy Measure for Conformance Testing', 'year': 2008, 'cited_by_count': 605}]","['Algorithm', 'Anthropology', 'Archaeology', 'Artificial intelligence', 'Biochemistry', 'Bioinformatics', 'Biology', 'Botany', 'Business', 'Chemistry', 'Computational biology', 'Computer science', 'Computer security', 'Data mining', 'Data science', 'Database', 'Developmental psychology', 'Discrete mathematics', 'Distributed computing', 'Ecology']","['AT', 'AU', 'CA', 'CH', 'CN', 'DE', 'ES', 'FR', 'GB', 'IT', 'KR', 'LU', 'NO', 'NZ', 'PT', 'US']",icse_2005_a4cb3ae5,Is Mutation an Appropriate Tool for Testing Experiments?,https://openalex.org/W2013711971
10.0,76.0,69.0,14.0,2004.0,2016.0,13.0,50,"[{'title': 'Predicting source code changes by mining change history', 'year': 2004, 'cited_by_count': 570}, {'title': 'On the naturalness of software', 'year': 2012, 'cited_by_count': 569}, {'title': 'Predicting Faults from Cached History', 'year': 2007, 'cited_by_count': 487}, {'title': 'PR-Miner', 'year': 2005, 'cited_by_count': 432}, {'title': 'A survey and taxonomy of approaches for mining software repositories in the context of software evolution', 'year': 2007, 'cited_by_count': 413}]","['Archaeology', 'Art', 'Artificial intelligence', 'Astronomy', 'Biochemistry', 'Biology', 'Botany', 'Business', 'Chemistry', 'Cognitive psychology', 'Combinatorics', 'Computer network', 'Computer science', 'Computer security', 'Computer vision', 'Data mining', 'Data science', 'Database', 'Ecology', 'Economics']","['AT', 'BE', 'BN', 'CA', 'CH', 'CN', 'DE', 'FR', 'GB', 'HK', 'IT', 'NL', 'SG', 'US']",icse_2004_5cf9d322,Mining Version Histories to Guide Software Changes,https://openalex.org/W2100849134
10.0,71.0,60.0,14.0,2004.0,2016.0,13.0,50,"[{'title': 'Mining version histories to guide software changes', 'year': 2005, 'cited_by_count': 846}, {'title': 'When do changes induce fixes?', 'year': 2005, 'cited_by_count': 799}, {'title': 'Mining metrics to predict component failures', 'year': 2006, 'cited_by_count': 775}, {'title': 'Predicting Defects for Eclipse', 'year': 2007, 'cited_by_count': 750}, {'title': 'An Exploratory Study of How Developers Seek, Relate, and Collect Relevant Information during Software Maintenance Tasks', 'year': 2006, 'cited_by_count': 672}]","['Aerospace engineering', 'Archaeology', 'Art', 'Artificial intelligence', 'Astronomy', 'Biochemistry', 'Biology', 'Botany', 'Business', 'Chemistry', 'Chromatography', 'Cognitive science', 'Computer network', 'Computer science', 'Computer security', 'Computer vision', 'Criminology', 'Data mining', 'Data science', 'Database']","['AT', 'BR', 'CA', 'CH', 'CN', 'DE', 'ES', 'FR', 'GB', 'HK', 'IN', 'IT', 'NL', 'US']",icse_2003_9c36f448,Hipikat: Recommending Pertinent Software Development Artifacts,https://openalex.org/W2171733741
8.0,63.0,64.0,19.0,2003.0,2024.0,22.0,50,"[{'title': 'Software Architecture as a Set of Architectural Design Decisions', 'year': 2006, 'cited_by_count': 602}, {'title': 'Software Component Models', 'year': 2007, 'cited_by_count': 326}, {'title': 'SOFA 2.0: Balancing Advanced Features in a Hierarchical Component Model', 'year': 2006, 'cited_by_count': 207}, {'title': 'Tool Support for Architectural Decisions', 'year': 2007, 'cited_by_count': 136}, {'title': 'A Comparison of Static Architecture Compliance Checking Approaches', 'year': 2007, 'cited_by_count': 124}]","['Algorithm', 'Anthropology', 'Archaeology', 'Art', 'Artificial intelligence', 'Astronomy', 'Biochemistry', 'Biology', 'Botany', 'Business', 'Chemical engineering', 'Chemistry', 'Computer architecture', 'Computer network', 'Computer science', 'Computer security', 'Data mining', 'Data science', 'Distributed computing', 'Ecology']","['AT', 'AU', 'BR', 'CH', 'CN', 'CZ', 'DE', 'FI', 'FR', 'GB', 'IE', 'IT', 'JP', 'NL', 'NO', 'PT', 'SG', 'TR', 'US']",icse_2002_6189aeca,ArchJava: Connecting Software Architecture to Implementation,https://openalex.org/W3142188450
17.0,60.0,60.0,16.0,2003.0,2023.0,21.0,50,"[{'title': 'Automatically Hardening Web Applications Using Precise Tainting', 'year': 2005, 'cited_by_count': 389}, {'title': 'Testing Web applications by modeling with FSMs', 'year': 2005, 'cited_by_count': 337}, {'title': 'Automated Test Case Generation as a Many-Objective Optimisation Problem with Dynamic Selection of the Targets', 'year': 2017, 'cited_by_count': 333}, {'title': 'State-Based Testing of Ajax Web Applications', 'year': 2008, 'cited_by_count': 234}, {'title': 'Leveraging user-session data to support Web application testing', 'year': 2005, 'cited_by_count': 215}]","['Algorithm', 'Anatomy', 'Archaeology', 'Artificial intelligence', 'Biochemistry', 'Biology', 'Botany', 'Chemistry', 'Chromatography', 'Combinatorics', 'Computer network', 'Computer science', 'Computer security', 'Data mining', 'Data science', 'Database', 'Distributed computing', 'Economics', 'Embedded system', 'Engineering']","['AU', 'CA', 'CZ', 'DE', 'ES', 'GB', 'IN', 'IT', 'LU', 'MY', 'NL', 'NZ', 'SA', 'SG', 'TW', 'US']",icse_2001_ddccec05,Analysis and testing of Web applications,https://openalex.org/W4247316974
27.0,80.0,80.0,24.0,2001.0,2021.0,21.0,50,"[{'title': 'The road ahead for Mining Software Repositories', 'year': 2008, 'cited_by_count': 329}, {'title': 'An empirical study of open-source and closed-source software products', 'year': 2004, 'cited_by_count': 317}, {'title': 'The many meanings of open source', 'year': 2004, 'cited_by_count': 224}, {'title': 'Achieving Quality in Open-Source Software', 'year': 2007, 'cited_by_count': 202}, {'title': 'A Comprehensive Review and Synthesis of Open Source Research', 'year': 2010, 'cited_by_count': 187}]","['Archaeology', 'Art', 'Artificial intelligence', 'Astronomy', 'Biology', 'Botany', 'Business', 'Cartography', 'Chemistry', 'Chromatography', 'Classics', 'Composite material', 'Computer hardware', 'Computer science', 'Computer security', 'Computer vision', 'Data mining', 'Data science', 'Database', 'Demography']","['AE', 'AU', 'BD', 'BR', 'CA', 'CN', 'DE', 'ES', 'FI', 'FR', 'GB', 'GR', 'ID', 'IE', 'IN', 'IT', 'KR', 'MY', 'NZ', 'SA']",icse_2000_1b942859,A case study of open source software development: the Apache server,https://openalex.org/W4250763772
18.0,57.0,67.0,18.0,2000.0,2022.0,23.0,50,"[{'title': 'Model Checking Programs', 'year': 2003, 'cited_by_count': 1351}, {'title': 'Exploring Multiple Execution Paths for Malware Analysis', 'year': 2007, 'cited_by_count': 489}, {'title': 'Model checking programs', 'year': 2000, 'cited_by_count': 338}, {'title': 'A Comparison of Bug Finding Tools for Java', 'year': 2005, 'cited_by_count': 275}, {'title': 'An Overview of the Runtime Verification Tool Java PathExplorer', 'year': 2004, 'cited_by_count': 223}]","['Advertising', 'Aerospace engineering', 'Algorithm', 'Artificial intelligence', 'Biochemistry', 'Biology', 'Botany', 'Business', 'Chemistry', 'Communication', 'Computer science', 'Computer security', 'Control engineering', 'Data mining', 'Data science', 'Database', 'Discrete mathematics', 'Distributed computing', 'Ecology', 'Economics']","['AU', 'BA', 'CA', 'CH', 'CN', 'DE', 'GB', 'IL', 'IN', 'IT', 'JP', 'MX', 'NL', 'PT', 'RO', 'SE', 'SG', 'US']",icse_2000_f354deec,Bandera: extracting finite-state models from Java source code,https://openalex.org/W4256144738
13.0,69.0,74.0,20.0,2000.0,2023.0,24.0,50,"[{'title': 'FEATUREHOUSE: Language-independent, automated software composition', 'year': 2009, 'cited_by_count': 245}, {'title': 'On the Reuse and Maintenance of Aspect-Oriented Software: An Assessment Framework', 'year': 2003, 'cited_by_count': 238}, {'title': 'An Empirical Study of RefactoringChallenges and Benefits at Microsoft', 'year': 2014, 'cited_by_count': 226}, {'title': 'Discovering and representing systematic code changes', 'year': 2009, 'cited_by_count': 183}, {'title': 'Blockchain as the Database Engine in the Accounting System', 'year': 2019, 'cited_by_count': 168}]","['Accounting', 'Advertising', 'Algorithm', 'Archaeology', 'Arithmetic', 'Art', 'Artificial intelligence', 'Astronomy', 'Biochemistry', 'Biology', 'Botany', 'Business', 'Chemistry', 'Combinatorics', 'Computer science', 'Computer security', 'Data mining', 'Data science', 'Database', 'Distributed computing']","['BE', 'BR', 'CA', 'CH', 'CN', 'DE', 'DK', 'ES', 'FR', 'GB', 'HK', 'IE', 'IN', 'JP', 'MX', 'NL', 'PL', 'PT', 'SG', 'US']",icse_1999_f470c157,N Degrees of Separation: Multi-Dimensional Separation of Concerns,https://openalex.org/W3149666682
16.0,71.0,62.0,18.0,1999.0,2022.0,24.0,50,"[{'title': 'A classification and comparison framework for software architecture description languages', 'year': 2000, 'cited_by_count': 1980}, {'title': 'Self-adaptive software', 'year': 2009, 'cited_by_count': 1234}, {'title': 'An architecture-based approach to self-adaptive software', 'year': 1999, 'cited_by_count': 985}, {'title': 'A survey of autonomic computing—degrees, models, and applications', 'year': 2008, 'cited_by_count': 842}, {'title': 'The JEDI event-based infrastructure and its application to the development of the OPSS WFMS', 'year': 2001, 'cited_by_count': 633}]","['Agronomy', 'Archaeology', 'Arithmetic', 'Art', 'Artificial intelligence', 'Astrophysics', 'Biochemistry', 'Biology', 'Botany', 'Business', 'Chemical engineering', 'Chemistry', 'Computer architecture', 'Computer network', 'Computer science', 'Computer security', 'Data science', 'Database', 'Distributed computing', 'Ecology']","['AT', 'AU', 'BE', 'BR', 'CA', 'CN', 'CZ', 'DE', 'ES', 'FR', 'GB', 'IE', 'IT', 'JP', 'NL', 'NO', 'SE', 'US']",icse_1998_f79e4ec6,Architecture-Based Runtime Software Evolution,https://openalex.org/W2134716336
24.0,73.0,57.0,22.0,1997.0,2019.0,23.0,50,"[{'title': 'Understanding code mobility', 'year': 1998, 'cited_by_count': 1175}, {'title': 'Efficient code distribution in wireless sensor networks', 'year': 2003, 'cited_by_count': 225}, {'title': 'FORMS', 'year': 2012, 'cited_by_count': 184}, {'title': 'Location-dependent query processing', 'year': 2010, 'cited_by_count': 151}, {'title': 'A survey of software adaptation in mobile and ubiquitous computing', 'year': 2010, 'cited_by_count': 105}]","['Aerospace engineering', 'Algorithm', 'Archaeology', 'Art', 'Artificial intelligence', 'Biochemistry', 'Biology', 'Business', 'Chemistry', 'Computer architecture', 'Computer network', 'Computer science', 'Computer security', 'Data mining', 'Data science', 'Database', 'Dentistry', 'Discrete mathematics', 'Distributed computing', 'Ecology']","['AT', 'BE', 'CH', 'CN', 'CY', 'CZ', 'DE', 'ES', 'FI', 'FR', 'GB', 'IE', 'IN', 'IT', 'JM', 'KR', 'NL', 'NO', 'SA', 'SE']",icse_1997_b6032ea7,Designing Distributed Applications with Mobile Code Paradigms,https://openalex.org/W1972420889
18.0,72.0,75.0,15.0,1997.0,2021.0,25.0,50,"[{'title': 'Four dark corners of requirements engineering', 'year': 1997, 'cited_by_count': 726}, {'title': 'A comparison of security requirements engineering methods', 'year': 2009, 'cited_by_count': 238}, {'title': 'Simulation in software engineering training', 'year': 2000, 'cited_by_count': 139}, {'title': 'A formal approach to adaptive software: continuous assurance of non-functional requirements', 'year': 2011, 'cited_by_count': 130}, {'title': 'A feature-oriented requirements modelling language', 'year': 2012, 'cited_by_count': 46}]","['Agronomy', 'Anthropology', 'Archaeology', 'Arithmetic', 'Art', 'Artificial intelligence', 'Biochemistry', 'Biology', 'Botany', 'Business', 'Chemistry', 'Cognitive science', 'Communication', 'Computer network', 'Computer science', 'Computer security', 'Criminology', 'Data mining', 'Data science', 'Database']","['AU', 'BE', 'BR', 'CA', 'CH', 'CN', 'DE', 'FR', 'GB', 'IE', 'IT', 'NL', 'RU', 'SE', 'US']",icse_1995_c9dd9bce,Deriving Specifications from Requirements: An Example,https://openalex.org/W3141311175
16.0,71.0,56.0,10.0,1994.0,2014.0,21.0,50,"[{'title': 'A classification and comparison framework for software architecture description languages', 'year': 2000, 'cited_by_count': 1980}, {'title': 'Interface automata', 'year': 2001, 'cited_by_count': 1177}, {'title': 'Abstractions for software architecture and tools to support them', 'year': 1995, 'cited_by_count': 811}, {'title': 'Specifying distributed software architectures', 'year': 1995, 'cited_by_count': 770}, {'title': 'Tools for Inventing Organizations: Toward a Handbook of Organizational Processes', 'year': 1999, 'cited_by_count': 756}]","['Aerospace engineering', 'Algorithm', 'Archaeology', 'Arithmetic', 'Art', 'Artificial intelligence', 'Biochemistry', 'Biology', 'Business', 'Chemistry', 'Classics', 'Computer architecture', 'Computer graphics (images)', 'Computer science', 'Computer security', 'Crystallography', 'Data science', 'Database', 'Distributed computing', 'Ecology']","['CN', 'DE', 'FR', 'GB', 'IR', 'IT', 'JP', 'NL', 'SE', 'US']",icse_1994_f5516959,Formalizing Architectural Connection,https://openalex.org/W2111164171
19.0,70.0,57.0,17.0,1993.0,2020.0,28.0,50,"[{'title': 'Towards modelling and reasoning support for early-phase requirements engineering', 'year': 2002, 'cited_by_count': 1570}, {'title': 'Inconsistency handling in multiperspective specifications', 'year': 1994, 'cited_by_count': 536}, {'title': 'Understanding “why” in software process modelling, analysis, and design', 'year': 1994, 'cited_by_count': 307}, {'title': 'Information modeling in the time of the revolution', 'year': 1998, 'cited_by_count': 235}, {'title': 'A goal-based framework for contextual requirements modeling and analysis', 'year': 2010, 'cited_by_count': 223}]","['Arithmetic', 'Art', 'Artificial intelligence', 'Astronomy', 'Biology', 'Botany', 'Business', 'Communication', 'Computer network', 'Computer science', 'Computer security', 'Data mining', 'Data science', 'Database', 'Distributed computing', 'Ecology', 'Economics', 'Electrical engineering', 'Electronic engineering', 'Engineering']","['AT', 'BE', 'CA', 'CH', 'CN', 'DE', 'ES', 'FI', 'FR', 'GB', 'IE', 'IR', 'IT', 'JP', 'NO', 'SE', 'US']",icse_1993_c5f879d8,Expressing the Relationships between Multiple Views in Requirements Specification,https://openalex.org/W2150829668
14.0,69.0,54.0,16.0,1993.0,2025.0,33.0,50,"[{'title': 'A Survey on Software Fault Localization', 'year': 2016, 'cited_by_count': 1063}, {'title': 'Handling obstacles in goal-oriented requirements engineering', 'year': 2000, 'cited_by_count': 651}, {'title': 'TestTube: a system for selective regression testing', 'year': 1994, 'cited_by_count': 263}, {'title': 'Beyond Assertions: Advanced Specification and Verification with JML and ESC/Java2', 'year': 2006, 'cited_by_count': 194}, {'title': 'How the design of JML accommodates both runtime assertion checking and formal verification', 'year': 2004, 'cited_by_count': 190}]","['Aerospace engineering', 'Algorithm', 'Archaeology', 'Arithmetic', 'Artificial intelligence', 'Astronomy', 'Biology', 'Botany', 'Business', 'Computer architecture', 'Computer hardware', 'Computer network', 'Computer science', 'Computer security', 'Data mining', 'Data science', 'Database', 'Distributed computing', 'Economics', 'Electrical engineering']","['AT', 'BE', 'CA', 'CH', 'CN', 'DE', 'FR', 'GB', 'IE', 'IT', 'MY', 'NL', 'SA', 'SE', 'SG', 'US']",icse_1992_202e0644,Towards a Method of Programming with Assertions,https://openalex.org/W2124545556
16.0,68.0,48.0,16.0,1994.0,2020.0,27.0,50,"[{'title': 'A framework for expressing the relationships between multiple views in requirements specification', 'year': 1994, 'cited_by_count': 543}, {'title': 'Inconsistency handling in multiperspective specifications', 'year': 1994, 'cited_by_count': 536}, {'title': 'Software process', 'year': 2000, 'cited_by_count': 403}, {'title': 'Model-driven development: The good, the bad, and the ugly', 'year': 2006, 'cited_by_count': 292}, {'title': 'xlinkit', 'year': 2002, 'cited_by_count': 273}]","['Algorithm', 'Arithmetic', 'Art', 'Artificial intelligence', 'Astronomy', 'Biochemistry', 'Biology', 'Business', 'Chemistry', 'Climatology', 'Computer network', 'Computer science', 'Data mining', 'Data science', 'Database', 'Discrete mathematics', 'Distributed computing', 'Ecology', 'Economics', 'Economy']","['AT', 'AU', 'BE', 'CA', 'CN', 'DE', 'ES', 'FR', 'GB', 'HK', 'IE', 'IT', 'JP', 'PT', 'SE', 'US']",icse_1991_278e93a0,Tolerating Inconsistency,https://openalex.org/W2294967233
14.0,70.0,48.0,14.0,1989.0,2014.0,26.0,50,"[{'title': 'Foundations for the study of software architecture', 'year': 1992, 'cited_by_count': 2009}, {'title': 'Handling obstacles in goal-oriented requirements engineering', 'year': 2000, 'cited_by_count': 651}, {'title': 'Version models for software configuration management', 'year': 1998, 'cited_by_count': 579}, {'title': 'A state-of-the-art survey on software merging', 'year': 2002, 'cited_by_count': 527}, {'title': 'Specification matching of software components', 'year': 1997, 'cited_by_count': 518}]","['Algorithm', 'Archaeology', 'Arithmetic', 'Art', 'Artificial intelligence', 'Biochemistry', 'Biology', 'Botany', 'Business', 'Chemistry', 'Cognitive science', 'Computer graphics (images)', 'Computer hardware', 'Computer network', 'Computer science', 'Computer vision', 'Data mining', 'Data science', 'Database', 'Discrete mathematics']","['AT', 'BE', 'CA', 'CH', 'DE', 'FR', 'GB', 'IN', 'IT', 'KR', 'MX', 'NO', 'PT', 'US']",icse_1989_3ce99cbd,The Inscape Environment,https://openalex.org/W2104182286
20.0,73.0,51.0,13.0,1988.0,2018.0,31.0,50,"[{'title': 'On visual formalisms', 'year': 1988, 'cited_by_count': 1269}, {'title': 'The STATEMATE semantics of statecharts', 'year': 1996, 'cited_by_count': 1042}, {'title': ""A specifier's introduction to formal methods"", 'year': 1990, 'cited_by_count': 728}, {'title': 'Requirements engineering with viewpoints', 'year': 1996, 'cited_by_count': 297}, {'title': 'A survey of architecture description languages', 'year': 1996, 'cited_by_count': 286}]","['Aerospace engineering', 'Algorithm', 'Anthropology', 'Archaeology', 'Arithmetic', 'Art', 'Artificial intelligence', 'Biology', 'Botany', 'Business', 'Cartography', 'Civil engineering', 'Cognitive science', 'Computer architecture', 'Computer engineering', 'Computer network', 'Computer science', 'Data mining', 'Data science', 'Database']","['AR', 'BE', 'CA', 'DE', 'FR', 'GB', 'HK', 'IL', 'IT', 'JP', 'NL', 'NO', 'US']",icse_1988_97b81ae0,A Working Environment for the Development of Complex Reactive Systems,https://openalex.org/W2010795160
